{
  "taskId": "grok-worker-6814787f-5c10-45e1-8d44-3fbb48f7e5a0",
  "stage": "GROK-WORKER-PROVIDER-V5",
  "objective": "Implement the complete GROK-WORKER-PROVIDER availability layer per docs/contracts/AVAILABILITY-LAYER.plan.v5.md and docs/contracts/GROK-WORKER-PROVIDER.plan.md: G-0 process-local compat hooks, availability ledger state machine/bootstrap/nextProbeAt, strict error classification, lock lifecycle and WAL, explicit/pool schema, explicit probePolicy, safe multi-profile failover, optional hardened billing snapshot, atomic versioned deployment pointer, mock fixtures and harnesses. First inspect current code and update your plan; then implement and run local mock tests. Preserve all security invariants. Do not read/copy/hash auth.json, do not use default .grok, do not run OAuth/login/logout/account switch/service control/Git commit or push, do not call direct grok.cmd/exe, and do not touch D:\\Grok UI runtime directories. Return a Result Capsule and stop.",
  "baseCommit": "0000000000000000000000000000000000000000",
  "workspace": "D:\\Grok Worker Provider",
  "worktree": {
    "mode": "exclusive-worktree",
    "path": "D:\\Grok Worker Provider"
  },
  "allowedFiles": [
    "bin/**",
    "lib/**",
    "schemas/**",
    "tests/**",
    "fixtures/**",
    "docs/**",
    "README.md",
    "package.json",
    ".codex/grok-tasks/**"
  ],
  "forbiddenActions": [
    "service control",
    "OAuth",
    "account switch",
    "delete data"
  ],
  "acceptanceCommands": [
    "controller verifies Result Capsule and usage ledger"
  ],
  "contextRefs": [
    "docs/contracts/AVAILABILITY-LAYER.plan.v5.md",
    "docs/contracts/GROK-WORKER-PROVIDER.plan.md"
  ],
  "realRequestPermission": "allowed",
  "serviceControlPermission": "denied",
  "gitPermission": "read-only",
  "grokSessionId": null,
  "resumePolicy": {
    "mode": "new-only",
    "rule": "Never resume an unrelated session."
  },
  "explicitStop": "Run the v5 mock acceptance suite, return a complete Result Capsule with changedFilesFinalState, tests, residual risks, and stop. Do not commit or deploy.",
  "model": "grok-4.5",
  "reasoning": "high",
  "speed": "standard",
  "profile": "example-account",
  "policy": {
    "access": "workspace-write",
    "bash": "denied",
    "agents": "denied",
    "mcp": "denied",
    "web": "denied"
  },
  "failover": {
    "allowedFallbackProfiles": [],
    "mode": "pre-first-request-only",
    "switchPermission": "denied"
  }
}
